name,date,lang,dur,genre,direc,act,c_rate,u_rate,desc,poster
The King's Speech,"04 Mar, 2011",[],Biography,,Tom Hooper,"['Colin Firth', 'Geoffrey Rush', 'Helena Bonham Carter']",4.0,4.2,"The King's Speech may be a historical film, but for cine-buffs hungry for refined cinema, this one may go down as celluloid history: an uplifting document on the human spirit.","https://static.toiimg.com/thumb/msid-61914123,width-219,height-317/61914123.jpg"
Black Swan,"04 Mar, 2011",[],Drama,,Darren Aronofsky,"['Natalie Portman', 'Mila Kunis', 'Barbara Hershey']",4.0,4.0,,"https://static.toiimg.com/thumb/msid-61914123,width-219,height-317/61914123.jpg"
Hall Pass,"04 Mar, 2011",[],Comedy,,Owen WilsonActor,"['Jason Sudeikis', 'Christina Applegate', 'Jenna Fischer']",2.5,2.7,,"https://static.toiimg.com/thumb/msid-61914123,width-219,height-317/61914123.jpg"
The Way Back,"04 Mar, 2011",[],Drama,,Peter Weir,"['Jim Sturgess', 'Colin Farrell', 'Ed Harris']",3.5,3.4,"Weir's films may not be mainstream, but they have a flavour that suitably engages the serious film buff. The Way Back is a gripping watch.","https://static.toiimg.com/thumb/msid-61914123,width-219,height-317/61914123.jpg"
Drive Angry,"25 Feb, 2011",[],Action,,William FichtnerActor,,3.0,2.9,"It is this unpredictable journey into the world of the undead that makes this drive a crazy ride. Enjoy, full throttle.","https://static.toiimg.com/thumb/msid-61914123,width-219,height-317/61914123.jpg"
True Grit,"25 Feb, 2011",[],Western,,Ethan Coen,"['Jeff Bridges', 'Matt Damon', 'Josh Brolin']",3.0,3.6,It is the gritty narrative and the purist style that pulls you towards this old-fashioned tale of old-fashioned valour. Don't miss it.,"https://static.toiimg.com/thumb/msid-61914123,width-219,height-317/61914123.jpg"
The Fighter," 1 hr 45 mins
	    
	",['Action'],,,Christian BaleActor,,4.0,4.4,"A story of two half-brothers who try to create history in the boxing ring, the film is based on a real life story of Micky Ward.","https://static.toiimg.com/thumb/msid-61914123,width-219,height-317/61914123.jpg"
I Am Number Four,"18 Feb, 2011",[],Sci-Fi,,Alex PettyferActor,,3.0,3.1,"We don't get to really know what bothers the Mogadarians, but be ready to see more of them as this comic book caper shows enough promise to generate sequels. A fun watch.","https://static.toiimg.com/thumb/msid-61914123,width-219,height-317/61914123.jpg"
How Do You Know,"18 Feb, 2011",[],Romance,,Reese WitherspoonActor,"['Owen Wilson', 'Paul Rudd', 'Jack Nicholson']",3.0,2.5,,"https://static.toiimg.com/thumb/msid-61914123,width-219,height-317/61914123.jpg"
The Nutcracker,"18 Feb, 2011",[],Fantasy,,Andrey Konchalovskiy,"['Elle Fanning', 'Nathan Lane', 'John Turturro']",3.0,2.8,"This one's a picturesque parable that has acquired cult status in its ballet form. This time, it re-appears as a straight feature that holds appeal, both for kids and adults. Great fun.","https://static.toiimg.com/thumb/msid-61914123,width-219,height-317/61914123.jpg"
Rabbit Hole,"18 Feb, 2011",[],Drama,,John Cameron Mitchell,,3.5,2.8,"Watch out for Nicole's Oscar nominated performances as the dysfunctional woman, desperately trying to regain her equilibrium. It's delicate and dignified.","https://static.toiimg.com/thumb/msid-61914123,width-219,height-317/61914123.jpg"
The Mechanic,"11 Feb, 2011",[],Action,,Simon West,"['Jason Statham', 'Ben Foster', 'Donald Sutherland']",3.0,2.9,This one's a sure-watch for Statham fans. Of course don't commit the folly of watching the 1972 version before this because Jason Statham can never stand up to Charles Bronson.,"https://static.toiimg.com/thumb/msid-61914123,width-219,height-317/61914123.jpg"
The Rite,"11 Feb, 2011",[],Horror,,Anthony HopkinsActor,,2.5,2.4,,"https://static.toiimg.com/thumb/msid-61914123,width-219,height-317/61914123.jpg"
No Strings Attached,"11 Feb, 2011",[],Romance,,Ivan Reitman,"['Ashton Kutcher', 'Natalie Portman', 'Kevin Kline']",3.0,3.4,,"https://static.toiimg.com/thumb/msid-61914123,width-219,height-317/61914123.jpg"
Biutiful,"04 Feb, 2011",[],Drama,,Javier BardemActor,,3.5,3.6,"Biutiful is a gritty ode to the human spirit which never does give up, even if all the odds are piled up against it.","https://static.toiimg.com/thumb/msid-61914123,width-219,height-317/61914123.jpg"
Sanctum,"04 Feb, 2011",[],Adventure,,Alister Grierson,"['Ioan Gruffudd', 'Alice Parkinson', 'Rhys Wakefield']",2.0,2.4,,"https://static.toiimg.com/thumb/msid-61914123,width-219,height-317/61914123.jpg"
Alpha & Omega,"04 Feb, 2011",[],Animation,,Hayden PanettiereActor,,2.0,2.1,"This one's quite indeterminate. Neither cute enough for kids, nor smart enough for adults, the wolfish affair has nothing much to offer to anyone.","https://static.toiimg.com/thumb/msid-61914123,width-219,height-317/61914123.jpg"
Burlesque,"28 Jan, 2011",[],Musical,,Steve Antin,"['Cher', 'Christina Aguilera', 'Stanley Tucci']",3.0,2.6,"It may have a predictable plot and a done-to-death drama, but Burlesque keeps you attentive with its colours, cadence and canvas.","https://static.toiimg.com/thumb/msid-61914123,width-219,height-317/61914123.jpg"
127 Hours,"28 Jan, 2011",[],Thriller,,Danny Boyle,"['James Franco', 'Kate Mara', 'Amber Tamblyn']",4.0,3.9,,"https://static.toiimg.com/thumb/msid-61914123,width-219,height-317/61914123.jpg"
Little Fockers,"21 Jan, 2011",[],Comedy,,Paul Weitz,"['Ben Stiller', 'Teri Polo', 'Jessica Alba']",2.5,1.9,The Focker franchise which was such a rib-tickler in its earlier versions does seem to have lost some of its fun in the third sequel.,"https://static.toiimg.com/thumb/msid-61914123,width-219,height-317/61914123.jpg"
The Season Of The Witch,"21 Jan, 2011",[],Fantasy,,Dominic Sena,,2.5,2.2,There is too much mumbo-jumbo and old-fashioned tantra-mantra in The Season of The Witch to engage the modern mindset.,"https://static.toiimg.com/thumb/msid-61914123,width-219,height-317/61914123.jpg"
Tangled,"21 Jan, 2011",[],Animation,,Nathan Greno,,3.5,3.7,"The state-of-the-art 3-D transforms the fairy tale into an eye-popping story. Go get your fill, with friends and family.","https://static.toiimg.com/thumb/msid-61914123,width-219,height-317/61914123.jpg"
Another Year,"21 Jan, 2011",[],Drama,,Mike Leigh,"['Jim Broadbent', 'Ruth Sheen', 'Imelda Staunton']",4.0,3.1,"Watch the film for its compelling performances, specially by Leslie Manville, who is absolutely brilliant as the sad yet strong and self-respecting Mary.","https://static.toiimg.com/thumb/msid-61914123,width-219,height-317/61914123.jpg"
The Green Hornet,"14 Jan, 2011",[],Adventure,,Michel Gondry,"['Seth Rogen', 'Jay Chou', 'Cameron Diaz']",3.5,3.5,"Witty dialogues, bumbling heroes, zany bad guys, high-voltage action, The Green Hornet is a fun make-over of the super hero movie. Don't miss it.","https://static.toiimg.com/thumb/msid-61914123,width-219,height-317/61914123.jpg"
Life As We know It,"07 Jan, 2011",[],Romance,,Greg Berlanti,"['Katherine Heigl', 'Josh Duhamel', 'Josh Lucas']",3.0,2.6,"Sentimental, sweet and spilling over with slapstick gags, Life As We Know It is Hollywood romance, as we know it. Fun while it lasts.","https://static.toiimg.com/thumb/msid-61914123,width-219,height-317/61914123.jpg"
Fair Game,"07 Jan, 2011",[],Thriller,,Doug Liman,"['Naomi Watts', 'Sean Penn', 'Noah Emmerich']",3.5,2.2,,"https://static.toiimg.com/thumb/msid-61914123,width-219,height-317/61914123.jpg"
Gulliver's Travels,"31 Dec, 2010",[],Comedy,,Rob Letterman,"['Jack Black', 'Amanda Peet', 'Emily Blunt']",3.0,2.8,Watch out for Jack Black's zany rendition of the classic hero who is first held captive by pint-sized people and then punched around by a giant-sized doll.,"https://static.toiimg.com/thumb/msid-61914123,width-219,height-317/61914123.jpg"
Megamind,"24 Dec, 2010",[],Animation,,Tom McGrath,"['Brad Pitt', 'Tina Fey', 'Jonah Hill']",3.0,3.3,,"https://static.toiimg.com/thumb/msid-61914123,width-219,height-317/61914123.jpg"
You Will Meet a Tall Dark Stranger,"17 Dec, 2010",[],Drama,,Woody Allen,"['Antonio Banderas', 'Josh Brolin', 'Anthony Hopkins']",3.0,2.6,"The film isn't writer-director Woody Allen's best. But if you've seen 39 of his earlier films, you must see the 40th too!","https://static.toiimg.com/thumb/msid-61914123,width-219,height-317/61914123.jpg"
The Tourist," 1 hr 38 mins
	    
	",['Drama'],,,Florian Henckel Von Donnersmarck,"['Johnny Depp', 'Angelina Jolie', 'Paul Bettany']",3.0,3.1,"Elise (Angelina Jolie), a mysterious woman who is under surveillance by Scotland Yard, the Interpol and a bunch of bad guys, meets and falls in love with an American tourist, Frank (Johnny Depp).","https://static.toiimg.com/thumb/msid-61914123,width-219,height-317/61914123.jpg"
Tron: Legacy,"17 Dec, 2010",[],Action,,Jeff BridgesActor,,3.0,2.6,"You do sit and gawk at the natty 3-D elegance and the combat-game format which has anyhow captured the 21st century imagination, kids and adults, alike.","https://static.toiimg.com/thumb/msid-61914123,width-219,height-317/61914123.jpg"
The Warrior's Way,"10 Dec, 2010",[],Action,,Kate BosworthActor,,3.0,2.5,"The film moves languorously, sometimes too slowly, and manages to draw you with its eclectic appeal. Go for the different look and the blending of genres.","https://static.toiimg.com/thumb/msid-61914123,width-219,height-317/61914123.jpg"
Faster,"10 Dec, 2010",[],Action,,dwayne johnsonActor,"['Billy Bob Thornton', 'Carla Gugino', 'Tom Berenger']",2.5,2.2,,"https://static.toiimg.com/thumb/msid-61914123,width-219,height-317/61914123.jpg"
The Chronicles of Narnia: The Voyage of the Dawn Treader,"03 Dec, 2010",[],Adventure,,Michael Apted,"['Georgie Henley', 'Skandar Keynes', 'Ben Barnes']",3.0,3.2,"The third part in the fantasy series holds merit on its own and manages to hold you in your seat with its mix of make-believe, special effects and fairy tale folklore.","https://static.toiimg.com/thumb/msid-61914123,width-219,height-317/61914123.jpg"
Secretariat,"26 Nov, 2010",[],Drama,,Randall Wallace,,3.0,2.6,"The real drama picks up only in the final few moments of the movie when Secretariat, steals the show with with his racing moments. Exciting yet predictable.","https://static.toiimg.com/thumb/msid-61914123,width-219,height-317/61914123.jpg"
Unstoppable,"26 Nov, 2010",[],Thriller,,Tony Scott,"['Denzel Washington', 'Chris Pine', 'Rosario Dawson']",3.0,3.0,"The film does move on predictable lines, nevertheless, the well-crafted sound and action sequences make the film worth a visit.","https://static.toiimg.com/thumb/msid-61914123,width-219,height-317/61914123.jpg"
Red,"26 Nov, 2010",[],Action,,Robert Schwentke,"['Bruce Willis', 'Morgan Freeman', 'John Malkovich']",3.0,2.8,,"https://static.toiimg.com/thumb/msid-61914123,width-219,height-317/61914123.jpg"
Harry Potter and the Deathly Hallows: Part 1,"19 Nov, 2010",[],Adventure,,David Yates,"['Emma Watson', 'Rupert Grint', 'Ralph Fiennes']",3.5,4.1,,"https://static.toiimg.com/thumb/msid-61914123,width-219,height-317/61914123.jpg"
The Social Network,"12 Nov, 2010",[],Drama,,David Fincher,"['Jesse Eisenberg', 'Andrew Garfield', 'Justin Timberlake']",4.5,4.2,,"https://static.toiimg.com/thumb/msid-61914123,width-219,height-317/61914123.jpg"
Skyline,"12 Nov, 2010",[],Sci-Fi,,Eric BalfourActor,,2.0,1.7,,"https://static.toiimg.com/thumb/msid-61914123,width-219,height-317/61914123.jpg"
Due Date,"05 Nov, 2010",[],Comedy,,Todd Phillips,,4.0,4.2,,"https://static.toiimg.com/thumb/msid-61914123,width-219,height-317/61914123.jpg"
Piranha,"29 Oct, 2010",[],Thriller,,Alexandre Aja,,3.0,2.8,,"https://static.toiimg.com/thumb/msid-61914123,width-219,height-317/61914123.jpg"
From Paris With Love," 1 hr 35 mins
	    
	",['Action'],,,Pierre Morel,"['John Travolta', 'Jonathan Rhys Meyers', 'Kasia Smutniak']",3.0,2.9,"James Reece , an aide to the US ambassador in Paris, has just got engaged to a beautiful French girl, Caroline and would like to spend the rest of the week serenading her.","https://static.toiimg.com/thumb/msid-61914123,width-219,height-317/61914123.jpg"
The Other Guys,"22 Oct, 2010",[],Comedy,,Adam McKay,,3.0,2.3,"Light and breezy, The Other Guys is your cop house comedy which runs through a familiar track where fifteen minutes of fame do come, but only when our common man types have been tried and tested.","https://static.toiimg.com/thumb/msid-61914123,width-219,height-317/61914123.jpg"
Letters to Juliet,"22 Oct, 2010",[],Romance,,Amanda SeyfriedActor,"['Vanessa Redgrave', 'Christopher Egan', 'Gael Garcia Bernal']",3.5,3.4,"Set against the breathtaking scenery of the Tuscan backdrop, Letters to Juliet is a love story that makes you want to believe in the legend of Romeo and Juliet.","https://static.toiimg.com/thumb/msid-61914123,width-219,height-317/61914123.jpg"
The Switch,"15 Oct, 2010",[],Drama,,Jennifer AnistonActor,"['Jason Bateman', 'Patrick Wilson', 'Jeff Goldblum']",3.0,2.4,,"https://static.toiimg.com/thumb/msid-61914123,width-219,height-317/61914123.jpg"
Eat Pray Love,"08 Oct, 2010",[],Drama,,Ryan Murphy,"['Julia Roberts', 'Javier Bardem', 'Billy Crudup']",3.0,2.4,"The film manages to carry you through its cross-country journey, peppered with scenic locales and attention-grabbing characters, the credit for which goes to Julia Roberts.","https://static.toiimg.com/thumb/msid-61914123,width-219,height-317/61914123.jpg"
The Town,"08 Oct, 2010",[],Crime,,"Ben Affleck, Actor","['Rebecca Hall', 'Jeremy Renner', 'Jon Hamm']",4.0,3.7,,"https://static.toiimg.com/thumb/msid-61914123,width-219,height-317/61914123.jpg"
The American,"01 Oct, 2010",[],Thriller,,Anton Corbijn,"['George Clooney', 'Violante Placido', 'Thekla Reuten']",3.5,3.6,,"https://static.toiimg.com/thumb/msid-61914123,width-219,height-317/61914123.jpg"
Going the Distance,"01 Oct, 2010",[],Romance,,Drew BarrymoreActor,,2.0,1.7,,"https://static.toiimg.com/thumb/msid-61914123,width-219,height-317/61914123.jpg"
Beauty And the Beast,"24 Sep, 2010",[],Animation,,Robby BensonActor,,3.0,3.2,"There's the sublime beauty of a forgotten world and the promise of happily-ever-after to draw you to one of your favourite fairy tales, once again. Give it an encore.","https://static.toiimg.com/thumb/msid-61914123,width-219,height-317/61914123.jpg"
Wall Street: Money Never Sleeps,"24 Sep, 2010",[],Drama,,Oliver Stone,"['Michael Douglas', 'Shia LaBeouf', 'Josh Brolin']",3.5,3.9,,"https://static.toiimg.com/thumb/msid-61914123,width-219,height-317/61914123.jpg"
A Distant Mirage,"17 Sep, 2010",[],Drama,,Joel FryActor,,2.0,1.8,"Sadly, there isn't enough -- neither story, nor performances -- to sustain a decent run for A Distant Mirage. Too much has already been said on the issue.","https://static.toiimg.com/thumb/msid-61914123,width-219,height-317/61914123.jpg"
Crank: High Voltage,"17 Sep, 2010",[],Action,,Mark Neveldine,"['Jason Statham', 'Amy Smart', 'Bai Ling']",2.5,2.1,"The filmmakers don't seem to be taking themselves seriously. Neither should we. So all you diehard action buffs can take a chance with Crank 2. It is high voltage action, albeit with a jaded edge.","https://static.toiimg.com/thumb/msid-61914123,width-219,height-317/61914123.jpg"
Shanghai,"17 Sep, 2010",[],Drama,,Mikael Hafstrom,,3.0,2.8,"The drama might not engage you with its heavy political overtones, its outdated tenor and its overriding seriousness. But the star cast definitely will.","https://static.toiimg.com/thumb/msid-61914123,width-219,height-317/61914123.jpg"
Resident Evil: Afterlife,"10 Sep, 2010",[],Action,,Milla JovovichActor,,3.0,3.1,"All the alpha and brawn show doesn't stop your attention wavering mid-film when testosterone is side-tracked for testy, long drawn conversation.","https://static.toiimg.com/thumb/msid-61914123,width-219,height-317/61914123.jpg"
Avatar:Special Edition,"27 Aug, 2010",[],Action,,James Cameron,"['Sam Worthington', 'Zoe Saldana', 'Stephen Lang']",5.0,4.5,"You can hardly spot the difference between the old and the new Avatar, unless you've studied it minutely and seen it several times in its first edition.","https://static.toiimg.com/thumb/msid-61914123,width-219,height-317/61914123.jpg"
Geng: The Adventure Begins,"27 Aug, 2010",[],Animation,,,,3.0,3.1,,"https://static.toiimg.com/thumb/msid-61914123,width-219,height-317/61914123.jpg"
Cats and Dogs: The Revenge of Kitty Galore,"20 Aug, 2010",[],Animation,,Brad Peyton,"['Nick Nolte', 'Christina Applegate', 'Bette Midler']",3.0,2.5,,"https://static.toiimg.com/thumb/msid-61914123,width-219,height-317/61914123.jpg"
Dinner for Schmucks,"13 Aug, 2010",[],Comedy,,Jay Roach,"['Steve Carell', 'Paul Rudd', 'Zach Galifianakis']",3.0,2.3,"Fun while it lasts, Dinner For Schmucks is a black comedy that is paced out and restrained. No loud laughs here. Just gentle chuckles.","https://static.toiimg.com/thumb/msid-61914123,width-219,height-317/61914123.jpg"
The Expendables,"13 Aug, 2010",[],Action,,"Sylvester Stallone, Actor","['Jason Statham', 'Jet Li', 'Mickey Rourke']",3.0,3.1,Don't go looking for a script. Just settle down for some vintage bang-bang stuff where guns were supposed to speak louder than special effects and guys had nothing to fall back on.,"https://static.toiimg.com/thumb/msid-61914123,width-219,height-317/61914123.jpg"
Grown Ups,"13 Aug, 2010",[],Comedy,,Dennis Dugan,"['Adam Sandler', 'Salma Hayek', 'Rob Schneider']",3.0,2.8,"Savour the Sandler brand of humour with Grown Ups, a film that once again celebrates the spirit of childhood, like most of his comedies.","https://static.toiimg.com/thumb/msid-61914123,width-219,height-317/61914123.jpg"
Predators,"06 Aug, 2010",[],Action,,Nimrod Antal,"['Adrien Brody', 'Alice Braga', 'Topher Grace']",2.5,2.1,,"https://static.toiimg.com/thumb/msid-61914123,width-219,height-317/61914123.jpg"
Despicable Me," 1 hr 35 mins
	    
	",['Animation'],,,Julie AndrewsActor,,3.5,4.1,"Despicable Gru (Steve Carell) has just one ambition. He wants to be the perfect anti-hero and showcase some super villainy. And how does he propose to do so? By stealing the moon. But before he can do that, he must steal into the house of the evil nerd, Vector (Jason Segal) and foil his attempts at a million dollar heist. For this, he needs to adopt three cute orphans from Miss Hattie's Home for Girls. The beginning of the transformation of Superbad Gru to Superdad Gru!","https://static.toiimg.com/thumb/msid-6266159,width-219,height-317,imgsize-1133/6266159.jpg"
The Twilight Saga: Eclipse,"30 Jul, 2010",[],Adventure,,David Slade,"['Robert Pattinson', 'Kristen Stewart', 'Taylor Lautner']",3.5,3.7,,"https://static.toiimg.com/thumb/msid-61914123,width-219,height-317/61914123.jpg"
Salt,"23 Jul, 2010",[],Action,,Phillip Noyce,,3.5,3.7,"It's Angelina Jolie, all the way. She's extremely watchable as the female agent who commendably stands up to the Bond and Bourne Inc.","https://static.toiimg.com/thumb/msid-61914123,width-219,height-317/61914123.jpg"
Inception,"16 Jul, 2010","['English', 'Telugu', 'Hindi']",2 hrs 22 mins,Action,Christopher Nolan,"['Leonardo DiCaprio', 'Ken Watanabe', 'Marion Cotillard']",5.0,4.4,,"https://static.toiimg.com/thumb/msid-61256646,width-219,height-317,imgsize-57181/61256646.jpg"
The Sorcerer's Apprentice,"16 Jul, 2010",[],Sci-fci,,Jay BaruchelActor,"['Alfred Molina', 'Teresa Palmer', 'Monica Bellucci']",3.0,3.5,"This one's a simple summer flick that keeps the popcorn crisp. However, the story isn't original and does fill you with a sense of deja vu.","https://static.toiimg.com/thumb/msid-61914123,width-219,height-317/61914123.jpg"
The Last Airbender,"09 Jul, 2010",[],Action,,Noah RingerActor,"['Dev Patel', 'Nicola Peltz', 'Jackson Rathbone']",3.0,3.1,,"https://static.toiimg.com/thumb/msid-61914123,width-219,height-317/61914123.jpg"
Knight and Day,"09 Jul, 2010",[],Action,,James Mangold,,3.5,3.6,"The action is completely over the top. And the film is such a chaloo cheeseburst, you just can't miss it. Go, sink your teeth in it.","https://static.toiimg.com/thumb/msid-61914123,width-219,height-317/61914123.jpg"
Spread,"02 Jul, 2010",[],Drama,,David Mackenzie,,3.5,3.1,Watch it for Ashton Kutcher and his pretty boy charms. And also for his existential dilemma: to be a gigolo or a grocery boy.,"https://static.toiimg.com/thumb/msid-61914123,width-219,height-317/61914123.jpg"
The Storm Warriors 2,"02 Jul, 2010",[],Action,,Aaron KwokActor,,3.0,3.0,,"https://static.toiimg.com/thumb/msid-61914123,width-219,height-317/61914123.jpg"
The Losers,"02 Jul, 2010",[],Action,,Sylvain White,"['Jeffrey Dean Morgan', 'Zoe Saldana', 'Chris Evans']",3.0,3.3,,"https://static.toiimg.com/thumb/msid-61914123,width-219,height-317/61914123.jpg"
Edge of Darkness,"25 Jun, 2010",[],Crime,,Martin Campbell,"['Mel Gibson', 'Ray Winstone', 'Danny Huston']",3.0,3.0,,"https://static.toiimg.com/thumb/msid-61914123,width-219,height-317/61914123.jpg"
Toy Story 3,"25 Jun, 2010",[],Animation,,Lee Unkrich,"['Tim Allen', 'Ned Beatty', 'Michael Keaton']",4.0,4.3,"There is colour, verve, drama, action, comedy, romance and 3D too. Add to this, a few wonderful take-home morals for our young and old viewers, and what more can you want.","https://static.toiimg.com/thumb/msid-61914123,width-219,height-317/61914123.jpg"
The A-Team,"25 Jun, 2010",[],Action,,Joe Carnahan,"['Liam Neeson', 'Bradley Cooper', 'Sharlto Copley']",3.5,3.5,"The A-Team is strictly for action buffs who love to OD on high-decibel AXN cuts. The action is superbly crafted, leaving no room for anything else.","https://static.toiimg.com/thumb/msid-61914123,width-219,height-317/61914123.jpg"
The Karate Kid,"11 Jun, 2010",[],Action,,Jackie ChanActor,,3.0,3.8,"The film has a lot to offer to young adults, but fails to rise to cult status. And that's only because the martial arts display is somewhat marginalised by the drama and relationship building.","https://static.toiimg.com/thumb/msid-61914123,width-219,height-317/61914123.jpg"
Robin Hood,"11 Jun, 2010",[],Drama,,Ridley Scott,"['Russell Crowe', 'Cate Blanchett', 'Mark Strong']",3.0,3.5,"Go watch this version, because the sequel is bound to follow. And then, we are sure, all hell will break lose....Savour the lull before the storm.","https://static.toiimg.com/thumb/msid-61914123,width-219,height-317/61914123.jpg"
Sex and the City 2,"11 Jun, 2010",[],Drama,,Sarah Jessica ParkerActor,,3.0,2.4,"The sequel may not be as spunky as the first film, yet, Sex and the City 2 has enough to keep the cosmo club grinning.","https://static.toiimg.com/thumb/msid-61914123,width-219,height-317/61914123.jpg"
Nightmare on ELM Street,"04 Jun, 2010",[],Horror,,Jackie Earle HaleyActor,,3.0,2.9,The new version may not be a revisionist tale and has nothing new to offer but it does have some old fashioned scares that still work.,"https://static.toiimg.com/thumb/msid-61914123,width-219,height-317/61914123.jpg"
Shutter Island,"04 Jun, 2010",[],Drama,,Martin Scorsese,"['Leonardo DiCaprio', 'Ben Kingsley', 'Mark Ruffalo']",4.0,4.0,"This one's a gritty drama, with Scorsese creating some marvellous set pieces where the past intervenes with the present and Leonardo creates a compelling picture of brooding disarray.","https://static.toiimg.com/thumb/msid-61914123,width-219,height-317/61914123.jpg"
Brick Lane,"28 May, 2010",[],Drama,,Satish KaushikActor,,4.0,3.5,Watch the film for the grandeur that both Satish Kaushik and Tannishtha Chatterjee invest in their role of the low key couple who try to cope with a changing world order.,"https://static.toiimg.com/thumb/msid-61914123,width-219,height-317/61914123.jpg"
Prince of Persia: The Sands of Time,"28 May, 2010",[],Adventure,,Mike Newell,"['Jake Gyllenhaal', 'Gemma Arterton', 'Ben Kingsley']",4.0,3.9,"The high point of the film is its stellar ensemble cast headed by Ben Kingsley who lends gravitas to the entire proceedings as Nizam, the King's brother.","https://static.toiimg.com/thumb/msid-61914123,width-219,height-317/61914123.jpg"
Daybreakers,"28 May, 2010",[],Sci-Fi,,Ethan HawkeActor,"['Willem Dafoe', 'Sam Neill', 'Claudia Karvan']",3.0,2.9,This one's for those who still haven't had their fill of vampire lore which happens to be the current craze in Hollywood and those who like their vampires mostly mean and monster-like.,"https://static.toiimg.com/thumb/msid-61914123,width-219,height-317/61914123.jpg"
Shrek Forever After,"21 May, 2010",[],Animation,,Mike Mitchell,"['Cameron Diaz', 'Antonio Banderas', 'Eddie Murphy']",3.0,3.7,"Go watch your favourite ogre live out the ugly-is-beautiful revisionist tale, once again. And make you feel good about it.","https://static.toiimg.com/thumb/msid-61914123,width-219,height-317/61914123.jpg"
Remember Me,"14 May, 2010",[],Romance,,Allen Coulter,"['Robert Pattinson', 'Emilie de Ravin', 'Pierce Brosnan']",3.5,3.8,"Set against 9/11, Remember Me is an immensely watchable romance, even as it paints a touching picture of loss and redemption against a violence-scarred backdrop. Raise a toast for RPatz.","https://static.toiimg.com/thumb/msid-61914123,width-219,height-317/61914123.jpg"
The Back-Up Plan,"14 May, 2010",[],Romance,,Alan Poul,,3.0,2.7,"It may be nothing to rave about, yet, The Back-Up Plan is good while it lasts, with Jennifer Lopez managing to hold your attention with her attempt at motherhood.","https://static.toiimg.com/thumb/msid-61914123,width-219,height-317/61914123.jpg"
The Last Song,"07 May, 2010",[],Drama,,Miley CyrusActor,,3.0,3.4,The highpoint of the film are the special moments created by Greg Kinnear and Miley Cyrus as they develop a warm and tender father-daughter relationship. Let them tug at your heart.,"https://static.toiimg.com/thumb/msid-61914123,width-219,height-317/61914123.jpg"
Iron Man 2,"07 May, 2010",[],Action,,Jon Favreau,,3.5,3.8,"The sequel is one hellish and hungama-filled ride into the world of high-octane drama. It may lack the finesse of the first film, but there's enough to keep the adrenalin pumping.","https://static.toiimg.com/thumb/msid-61914123,width-219,height-317/61914123.jpg"
