name,date,lang,dur,genre,direc,act,c_rate,u_rate,desc,poster
The Judge,"17 Oct, 2014",['English'],2 hrs 21 mins,Drama,David Dobkin,"['Robert Downey Jr.', 'Robert Duvall', 'Billy Bob Thornton']",4.0,4.0,The Judge is a great example of meticulously-crafted character portrayals and a film that carefully builds up each of the main characters over the course of its duration.,"https://static.toiimg.com/thumb/msid-61914123,width-219,height-317/61914123.jpg"
Dracula Untold,"17 Oct, 2014","['Hindi', 'English', 'Tamil']",1 hr 32 mins, Action Adventure,Gary Shore,"['Luke Evans', 'Thor Kristjansson', 'Charlie Cox']",3.0,3.2,"Luke Evans manages, in most parts, to get his teeth into the substance of Count Dracula's legend convincingly enough.","https://static.toiimg.com/thumb/msid-61242631,width-219,height-317,imgsize-34003/61242631.jpg"
What If,"17 Oct, 2014",['English'],1 hr 42 mins, Comedy Romance,Michael Dowse,"['Daniel Radcliffe', 'Zoe Kazan', 'Megan Park']",3.5,3.4,"Delightful but somewhat un-memorable, the energy of the film lies in the push-pull conflict between the two protagonists handled deftly by Radcliffe and Kazan.","https://static.toiimg.com/thumb/msid-61914123,width-219,height-317/61914123.jpg"
Left Behind,"10 Oct, 2014","['Hindi', 'English', 'Tamil']",1 hr 45 mins, Action Thriller,Vic Armstrong,"['Nicolas Cage', 'Lea Thompson', 'Nicky Whelan']",2.0,2.4,"The very concept of the Rapture could have been depicted with power and mystery, but instead the opposite is achieved in a film that just looks slapdash.","https://static.toiimg.com/thumb/msid-61914123,width-219,height-317/61914123.jpg"
Annabelle,"10 Oct, 2014",['English'],1 hr 39 mins,Horror,John R. Leonetti,"['Annabelle Wallis', 'Tony Amendola', 'Ward Horton']",3.0,3.2,"It will give you your money's worth, while not really serving you anything too memorable (or scary) as some of the other, more sinister horror films we've seen in the last few years.","https://static.toiimg.com/thumb/msid-61242607,width-219,height-317,imgsize-88007/61242607.jpg"
Deliver Us From Evil,"12 Sep, 2014",['English'],1 hr 58 mins,Horror,Scott Derrickson,"['Eric Bana', 'Edgar Ramirez', 'Olivia Munn']",3.0,3.0,"The film packs in a mixed bag of thrills that is, at times, deeply disturbing by virtue of using the kind of horror tropes that are more psychological than gory.","https://static.toiimg.com/thumb/msid-61241473,width-219,height-317,imgsize-154199/61241473.jpg"
Two Night Stand,"26 Sep, 2014",['English'],1 hr 23 mins,,Max Nichols,"['Analeigh Tipton', 'Miles Teller', 'Jessica Szohr']",3.5,3.3,"While the plot is simple enough, this is, in essence, a pretty candid and contemporary take on young love, with its many colourful details.","https://static.toiimg.com/thumb/msid-61914123,width-219,height-317/61914123.jpg"
Dolphin Tale 2,"19 Sep, 2014",['English'],1 hr 47 mins, Drama Family,Charles Martin Smith,"['Morgan Freeman', 'Harry Connick Jr.', 'Kris Kristofferson']",3.5,3.5,"Featuring a few beautiful scenes that will probably warm the heart of the most hardened cynic, Dolphin Tale 2 makes for some wholesome family fare.","https://static.toiimg.com/thumb/msid-62525612,width-219,height-317,imgsize-9141/62525612.jpg"
The Maze Runner,"19 Sep, 2014",['English'],1 hr 34 mins, Action Sci-Fi Mystery,Wes Ball,"['Dylan O Brien', 'Aml Ameen', 'Thomas Brodie Sangster']",4.0,3.8,,"https://static.toiimg.com/thumb/msid-61914123,width-219,height-317/61914123.jpg"
A Walk Among The Tombstones,"19 Sep, 2014",['English'],1 hr 56 mins,Thriller,Scott Frank,"['Liam Neeson', 'Maurice Compte', 'Adam David Thompson']",3.5,3.4,,"https://static.toiimg.com/thumb/msid-61914123,width-219,height-317/61914123.jpg"
The Prince,"12 Sep, 2014",['English'],1 hr 30 mins,Action,Brian A Miller,"['Bruce Willis', 'John Cusack', 'Jason Patric']",2.0,2.2,The greatest effort seems to have gone into getting the look of the fight scenes correctly in an otherwise bland film.,"https://static.toiimg.com/thumb/msid-61914123,width-219,height-317/61914123.jpg"
If I Stay,"05 Sep, 2014",['English'],1 hr 47 mins,Drama,R.J. Cutler,"['Stacy Keach', 'Mireille Enos', 'Jamie Blackley']",3.5,3.3,Chloë Grace Moretz manages to convey some delicate and bittersweet shades of love and romance with a maturity that prevents the movie from becoming a sob-fest.,"https://static.toiimg.com/thumb/msid-61914123,width-219,height-317/61914123.jpg"
Life of Crime,"05 Sep, 2014",['English'],1 hr 52 mins,Comedy,Daniel Schechter,"['Jennifer Aniston', 'Yasiin Bey', 'Isla Fisher']",3.0,3.0,"The film stops short of being something truly memorable but has just the right amount of witty turns, deft plot twists, funny situations and interesting characters.","https://static.toiimg.com/thumb/msid-61914123,width-219,height-317/61914123.jpg"
Sin City 2: A Dame To Kill For,"05 Sep, 2014",['English'],1 hr 39 mins,Action,Frank Miller,"['Mickey Rourke', 'Julia Garner', 'Lady Gaga']",3.5,3.4,"With its simple dialogues and also because it is in essence a gorgeous-looking tableaux, enjoy this slick slice of cinema more for its visuals rather than anything else.","https://static.toiimg.com/thumb/msid-61914123,width-219,height-317/61914123.jpg"
Step up All In,"29 Aug, 2014","['Hindi', 'English']",1 hr 52 mins, Drama Romance Music,Trish Sie,"['Ryan Guzman', 'Stephen Boss', 'Alyson Stoner']",3.0,3.2,"The film is like a bunch of music videos strung together with a romance angle. You don't go for this movie for scintillating dialogue, but to see them move it like experts on the dance floor.","https://static.toiimg.com/thumb/msid-61914123,width-219,height-317/61914123.jpg"
Teenage Mutant Ninja Turtles,"29 Aug, 2014","['Hindi', 'English', 'Tamil', 'Telugu']",1 hr 37 mins,Action,Jonathan Liebesman,"['Megan Fox', 'Tony Shalhoub', 'Whoopi Goldberg']",3.0,3.2,,"https://static.toiimg.com/thumb/msid-61242503,width-219,height-317,imgsize-34777/61242503.jpg"
The November Man,"29 Aug, 2014","['Hindi', 'English']",1 hr 48 mins,Action,Roger Donaldson,"['Pierce Brosnan', 'Olga Kurylenko', 'Luke Bracey']",3.0,3.1,"A big reason why you might want to see this film is because Pierce Brosnan is in it. And indeed, it is on his able shoulders that this movie rests.","https://static.toiimg.com/thumb/msid-61242563,width-219,height-317,imgsize-13936/61242563.jpg"
The Expendables 3,"22 Aug, 2014","['Hindi', 'English', 'Tamil', 'Telugu']",2 hrs 6 mins,Action,Patrick Hughes,"['Sylvester Stallone', 'Ronda Rousey', 'Kellan Lutz']",3.0,3.4,"While the action is indeed high gear, the gore (evidenced in the previous film) is turned down a notch. Nonetheless, it does serve up a decent chunk of old-school action.","https://static.toiimg.com/thumb/msid-61914123,width-219,height-317/61914123.jpg"
The Giver,"15 Aug, 2014",['English'],1 hr 37 mins,Drama,Phillip Noyce,"['Jeff Bridges', 'Odeya Rush', 'Cameron Monaghan']",3.0,3.1,"Despite the impressive cast (Taylor Swift has a cameo), performances are uneven. Bridges and Streep stand out but the others are somewhat unconvincing.","https://static.toiimg.com/thumb/msid-61914123,width-219,height-317/61914123.jpg"
The Hundred-Foot Journey,"08 Aug, 2014",['English'],2 hrs 2 mins,Drama,Lasse Hallstrom,"['Om Puri', 'Helen Mirren', 'Manish Dayal']",3.0,3.1,,"https://static.toiimg.com/thumb/msid-61914123,width-219,height-317/61914123.jpg"
Into the Storm,"08 Aug, 2014","['Hindi', 'English', 'Tamil']",1 hr 30 mins,Action,Steven Quale,"['Richard Armitage', 'Sarah Wayne Callies', 'Matt Walsh']",3.0,3.0,"If you get your jollies watching houses, cars and even a bunch of passenger planes flung into the air like toys, you might like this.","https://static.toiimg.com/thumb/msid-61241511,width-219,height-317,imgsize-109316/61241511.jpg"
Guardians of the Galaxy,"08 Aug, 2014","['Hindi', 'English']",2 hrs 1 mins,Action,James Gunn,"['Chris Pratt', 'Stan Lee', 'Rob Zombie']",4.0,4.0,"The charming performances, strange characters (don't miss Del Toro as The Collector), spaceships and the 70s soundtrack (a highlight by itself) make this one a heck of an intergalactic romp.","https://static.toiimg.com/thumb/msid-61241312,width-219,height-317,imgsize-157732/61241312.jpg"
Lucy,"01 Aug, 2014","['English', 'Tamil']",1 hr 30 mins,Sci-Fi,Luc Besson,"['Scarlett Johansson', 'Morgan Freeman', 'Amr Waked']",3.0,3.2,"Lucy may fail to woo the mainstream audience as it doesn't boast an extravagant budget or thrilling special effects. If you are a fan of 'experimental' cinema, you will appreciate this attempt.","https://static.toiimg.com/thumb/msid-61241487,width-219,height-317,imgsize-8274/61241487.jpg"
22 Jump Street,"01 Aug, 2014",['English'],1 hr 52 mins,Comedy,Phil Lord,"['Channing Tatum', 'Wyatt Russell', 'Nick Offerman']",3.5,3.5,All the veiled jokes as well as the blatant gags (Hill and Michael Bacall co-write) might even warrant a second viewing. Go for a load of laughs and stay for the end credits.,"https://static.toiimg.com/thumb/msid-61914123,width-219,height-317/61914123.jpg"
Hercules,"01 Aug, 2014","['Hindi', 'English', 'Tamil', 'Telugu']",1 hr 38 mins,Action,Brett Ratner,"['dwayne johnson', 'Rebecca Ferguson', 'Rufus Sewell']",3.0,3.4,"The climax could've been better and while the battles scenes aren't as epic as *Gladiator*, the film, along with its sprinkling of tongue-in-cheek lines, makes for a fun watch.","https://static.toiimg.com/thumb/msid-61241384,width-219,height-317,imgsize-14515/61241384.jpg"
The Grand Budapest Hotel,"25 Jul, 2014",['English'],1 hr 36 mins,Drama,Wes Anderson,"['Ralph Fiennes', 'Saoirse Ronan', 'Edward Norton']",4.0,3.7,"This whimsical tale oozes charm while brisk editing lets you enjoy - but not be overwhelmed by - cakes like mountains and mountains like cakes, chandeliers, perfumed men and Persian pussies.","https://static.toiimg.com/thumb/msid-62525471,width-219,height-317,imgsize-92423/62525471.jpg"
Planes: Fire & Rescue,"18 Jul, 2014",[],Animation,,Roberts Gannaway,"['Julie Bowen', 'Ed Harris', 'Curtis Armstrong']",2.5,2.6,"While the script is full of obvious aircraft metaphors which are funny, it lacks the kind of witticisms that elevate contemporary animated films so that they can be enjoyed by a much wider audience.","https://static.toiimg.com/thumb/msid-38546867,width-219,height-317,imgsize-45692/38546867.jpg"
Begin Again,"18 Jul, 2014",['English'],1 hr 44 mins,Drama,John Carney,"['Mark Ruffalo', 'Keira Knightley', 'Hailee Steinfeld']",3.5,3.3,"Decidedly different from super-budget, superhero fare, this one is sometimes sappy but mostly engaging and definitely driven by music.","https://static.toiimg.com/thumb/msid-61914123,width-219,height-317/61914123.jpg"
Dawn of the Planet of the Apes,"11 Jul, 2014","['Hindi', 'English', 'Tamil', 'Telugu']",2 hrs 15 mins,Sci-Fi,Matt Reeves,"['Andy Serkis', 'Jason Clarke', 'Gary Oldman']",4.0,4.0,"Emotionally intense, deeply absorbing and visually engaging, DOTPOTA is a solid build-up to another sequel. If not anything, you must watch it for Caesar aka motion capture maestro Andy Serkis.","https://static.toiimg.com/thumb/msid-61240523,width-219,height-317,imgsize-130968/61240523.jpg"
The Fault in Our Stars,"04 Jul, 2014",['English'],2 hrs 6 mins,Drama,Josh Boone,"['Shailene Woodley', 'Ansel Elgort', 'Nat Wolff']",4.0,3.9,"If you like feel-good, escapist films, this one's not for you. The Fault in Our Stars is one of the most unpretentious tragic love stories told in a heart-warming manner.","https://static.toiimg.com/thumb/msid-61914123,width-219,height-317/61914123.jpg"
Transformers: Age of Extinction,"27 Jun, 2014","['Hindi', 'English', 'Tamil', 'Telugu']",2 hrs 46 mins,Action,Michael Bay,"['Mark Wahlberg', 'Peter Cullen', 'Reno Wilson']",3.5,3.9,"Be it fiery photogenic explosions, smashing buildings, mega monster battles and more, there is no doubt that action rules this film.","https://static.toiimg.com/thumb/msid-61241130,width-219,height-317,imgsize-142556/61241130.jpg"
Chef,"20 Jun, 2014",['English'],2 hrs 0 mins,Comedy,"Jon Favreau, Actor","['Scarlett Johansson', 'Robert Downey Jr.', 'Bobby Cannavale']",3.5,3.4,"With food remaining the biggest star of this show, the side dishes also include some family-bonding as well. And the result is a serving of something refreshingly original.","https://static.toiimg.com/thumb/msid-61241346,width-219,height-317,imgsize-30905/61241346.jpg"
Grace of Monaco,"13 Jun, 2014",['English'],1 hr 42 mins,Biography,Olivier Dahan,"['Nicole Kidman', 'Nicholas Farrell', 'Derek Jacobi']",2.5,2.5,"Visually, the film looks pretty, no doubt. But that cannot hide the fact that there's barely enough substance to keep a viewer engaged.","https://static.toiimg.com/thumb/msid-61240235,width-219,height-317,imgsize-12214/61240235.jpg"
How to Train Your Dragon 2 (3D),"13 Jun, 2014","['Hindi', 'English', 'Tamil']",1 hr 42 mins,Animation,Dean DeBlois,"['Jay Baruchel', 'Gerard Butler', 'Cate Blanchett']",4.0,4.1,"Love, longing, tears, everlasting friendship...to watch the film in 3D is to live it. The dragons give you wings! They fly, you fly.","https://static.toiimg.com/thumb/msid-61240685,width-219,height-317,imgsize-153142/61240685.jpg"
Edge of Tomorrow,"06 Jun, 2014","['English', 'Telugu']",1 hr 53 mins,Sci-Fi,Doug Liman,"['Tom Cruise', 'Charlotte Riley', 'Dragomir Mrsic']",4.0,3.9,Writer Hiroshi Sakurazaka's story has solid sci-fi credentials and Tom Cruise proves that he still has the chops to pull off mega action movies.,"https://static.toiimg.com/thumb/msid-61914123,width-219,height-317/61914123.jpg"
Maleficent,"30 May, 2014",['English'],1 hr 37 mins, Action Adventure Family,Robert Stromberg,"['Angelina Jolie', 'Sharlto Copley', 'Elle Fanning']",3.5,3.4,,"https://static.toiimg.com/thumb/msid-61240539,width-219,height-317,imgsize-126353/61240539.jpg"
Blended,"30 May, 2014",['English'],1 hr 57 mins,Comedy,Frank Coraci,"['Adam Sandler', 'Drew Barrymore', 'Bella Thorne']",2.5,2.6,,"https://static.toiimg.com/thumb/msid-61914123,width-219,height-317/61914123.jpg"
The Raid 2,"30 May, 2014","['Hindi', 'English', 'Tamil']",2 hrs 29 mins,Action,Gareth Evans,"['Iko Uwais', 'Alex Abbad', 'Julie Estelle']",4.0,3.7,"If you enjoy savage, on-screen action that is unabashedly over-the-top and even sometimes borders on pastiche with all the gangster film tropes, don't hesitate to go watch this.","https://static.toiimg.com/thumb/msid-61914123,width-219,height-317/61914123.jpg"
X-Men: Days of Future Past,"23 May, 2014","['Hindi', 'English', 'Tamil', 'Telugu']",2 hrs 12 mins,Action,Bryan Singer,"['Patrick Stewart', 'Bingbing Fan', 'Omar Sy']",4.5,4.2,"While it assumes viewer familiarity with all the characters, *Days of Future Past* does manage the improbable task of combining almost everything that we love about the X-Men series, in one place.","https://static.toiimg.com/thumb/msid-61240891,width-219,height-317,imgsize-50176/61240891.jpg"
Fading Gigolo,"16 May, 2014",['English'],1 hr 30 mins,Comedy,"John Turturro, Actor","['Woody Allen', 'Sharon Stone', 'Vanessa Paradis']",3.0,3.0,,"https://static.toiimg.com/thumb/msid-61914123,width-219,height-317/61914123.jpg"
Godzilla,"16 May, 2014","['Hindi', 'English', 'Tamil', 'Telugu']",2 hrs 3 mins,Action,Gareth Edwards,"['Bryan Cranston', 'Ken Watanabe', 'Elizabeth Olsen']",3.5,3.7,,"https://static.toiimg.com/thumb/msid-61914123,width-219,height-317/61914123.jpg"
Million Dollar Arm,"09 May, 2014",['English'],2 hrs 1 mins,Drama,Craig Gillespie,"['Jon Hamm', 'Tzi Ma', 'Darshan Jariwala']",3.5,3.5,"Based on a true story, it's a film about hope, determination, believing in oneself and the importance of the journey as compared to the destination.","https://static.toiimg.com/thumb/msid-61241438,width-219,height-317,imgsize-24967/61241438.jpg"
The Amazing Spider-Man 2,"02 May, 2014","['Hindi', 'English', 'Tamil', 'Telugu']",2 hrs 22 mins,Adventure,Marc Webb,"['Andrew Garfield', 'Emma Stone', 'Jamie Foxx']",4.0,3.9,"The action sequences are breathtaking and despite the running time, the film doesn't drag. This Spider-Man serves up both pathos and power.","https://static.toiimg.com/thumb/msid-61914123,width-219,height-317/61914123.jpg"
Brick Mansions,"25 Apr, 2014","['English', 'Tamil']",1 hr 30 mins,Action,Camille Delamarre,"['Paul Walker', 'David Belle', 'RZA']",3.0,3.2,The film has a message at its core but the execution is way too simplistic with the actors acting as if they weren't paid. Action buffs can still watch it for the Parkour-infused chase sequences.,"https://static.toiimg.com/thumb/msid-61914123,width-219,height-317/61914123.jpg"
Tarzan,"25 Apr, 2014","['English', 'Tamil', 'Telugu']",1 hr 34 mins,Animation,Spencer LockeActor,"['Jaime Ray Newman', 'Mark Deklin', 'Joe Cappelletti']",2.0,2.4,,"https://static.toiimg.com/thumb/msid-61238696,width-219,height-317,imgsize-94879/61238696.jpg"
Son of God,"25 Apr, 2014","['Hindi', 'English', 'Tamil']",2 hrs 18 mins,Biography,Christopher Spencer,"['Diogo Morgado', 'Greg Hicks', 'Adrian Schiller']",2.5,2.7,"If you want to watch some really good movies inspired by and about the life of Christ, there are plenty of other options you can go for instead.","https://static.toiimg.com/thumb/msid-61241371,width-219,height-317,imgsize-9520/61241371.jpg"
Transcendence,"18 Apr, 2014",['English'],1 hr 59 mins,Sci-Fi,Wally Pfister,"['Johnny Depp', 'Rebecca Hall', 'Paul Bettany']",3.0,3.1,"The film is essentially a far-fetched, sometimes muddled, cautionary tale about mankind being taken over by the machines that they themselves have created, albeit with the best of intentions.","https://static.toiimg.com/thumb/msid-61914123,width-219,height-317/61914123.jpg"
Oculus,"11 Apr, 2014",['English'],1 hr 45 mins,Horror,Mike Flanagan,"['Karen Gillan', 'Brenton Thwaites', 'Annalise Basso']",3.5,3.4,"If you find mirrors spooky, stay away. And if you love to check yourself out in the mirror, this low-budget thriller will compel you to think otherwise.","https://static.toiimg.com/thumb/msid-62523759,width-219,height-317,imgsize-24754/62523759.jpg"
Rio 2,"11 Apr, 2014","['Hindi', 'English', 'Tamil']",1 hr 42 mins,Animation,Carlos Saldanha,"['Jesse Eisenberg', 'Kristin Chenoweth', 'Rita Moreno']",3.5,3.6,,"https://static.toiimg.com/thumb/msid-61240407,width-219,height-317,imgsize-57934/61240407.jpg"
Divergent,"11 Apr, 2014",['English'],2 hrs 20 mins,Action,Neil Burger,"['Shailene Woodley', 'Theo James', 'Ashley Judd']",3.5,3.5,At the heart of this dystopian tale awash in grays and browns is a lesson about finding one's identity and being at peace with oneself.,"https://static.toiimg.com/thumb/msid-61914123,width-219,height-317/61914123.jpg"
Captain America: The Winter Soldier,"04 Apr, 2014","['Hindi', 'English', 'Tamil', 'Telugu']",2 hrs 16 mins,Action,Anthony Russo,"['Chris Evans', 'Cobie Smulders', 'Robert Redford']",4.0,4.0,"Rogers might not have Batman's toys, Tony Stark's wisecracks or Superman's strength, but he is the most 'human'. This ranks among the finest in the superhero genre.","https://static.toiimg.com/thumb/msid-61241093,width-219,height-317,imgsize-42241/61241093.jpg"
Noah,"28 Mar, 2014",['English'],2 hrs 17 mins,Adventure,Darren Aronofsky,"['Russell Crowe', 'Leo McHugh Carroll', 'Nick Nolte']",3.5,3.5,,"https://static.toiimg.com/thumb/msid-61914123,width-219,height-317/61914123.jpg"
Sabotage,"28 Mar, 2014","['Hindi', 'English', 'Tamil', 'Telugu']",1 hr 49 mins,Action,David Ayer,"['arnold schwarzenegger', 'Sam Worthington', 'Joe Manganiello']",3.0,3.1,,"https://static.toiimg.com/thumb/msid-61241034,width-219,height-317,imgsize-48354/61241034.jpg"
Muppets Most Wanted,"21 Mar, 2014",['English'],1 hr 53 mins,Adventure,James Bobin,"['Ricky Gervais', 'Matt Vogel', 'Tom Hiddleston']",3.5,3.5,There are cameos aplenty in this fun film. And the song sequences are both fun and wacky - two words that sum up this film.,"https://static.toiimg.com/thumb/msid-61241018,width-219,height-317,imgsize-35837/61241018.jpg"
Need For Speed,"21 Mar, 2014","['Hindi', 'English', 'Tamil', 'Telugu']",2 hrs 10 mins,Action,Scott Waugh,"['Aaron Paul', 'Rami Malek', 'Michael Keaton']",3.5,3.6,"Apart from Paul's promising performance, it's the supercharged cars that tear up the asphalt and steal the show in this one.","https://static.toiimg.com/thumb/msid-61240931,width-219,height-317,imgsize-49526/61240931.jpg"
3 Days to Kill,"14 Mar, 2014","['English', 'Tamil']",1 hr 50 mins, Action Drama Crime,McG,"['Kevin Costner', 'Amber Heard', 'Connie Nielsen']",3.0,3.0,"Lighthearted while managing to mix a torture scene with a recipe for spaghetti sauce, the film's myriad elements come together with a deft touch, without losing the plot.","https://static.toiimg.com/thumb/msid-61241266,width-219,height-317,imgsize-40790/61241266.jpg"
Battle of the Damned,"14 Mar, 2014","['Hindi', 'English']",1 hr 22 mins,Action,Dolph LundgrenActor,"['Melanie Zanetti', 'Matt Doran', 'David Field']",2.0,2.1,"The film is about as literal as it gets, which is Dolph Lundgren shooting things, zombies and robots along with a lot of randomness.","https://static.toiimg.com/thumb/msid-61914123,width-219,height-317/61914123.jpg"
300: Rise of an Empire,"07 Mar, 2014","['Hindi', 'English', 'Tamil', 'Telugu']",1 hr 43 mins,Action,Eva GreenActor,"['Sullivan Stapleton', 'Rodrigo Santoro', 'Lena Headey']",4.0,4.4,"Although you would have seen many action films set during a point of time in history (this one's set in 480 BC), there is plenty in here to keep your attention from start to finish.","https://static.toiimg.com/thumb/msid-61239985,width-219,height-317,imgsize-163463/61239985.jpg"
August: Osage County,"10 Jan, 2014",['English'],2 hrs 0 mins,Drama,Meryl StreepActor,"['Julianne Nicholson', 'Dermot Mulroney', 'Margo Martindale']",4.0,3.7,"A gripping melodrama about the lives of the Westons, who gravitate back to their Oklahoma hometown, the film is about the interpersonal relationships of this family during a crisis situation.","https://static.toiimg.com/thumb/msid-61914123,width-219,height-317/61914123.jpg"
Mr. Peabody & Sherman 3D,"28 Feb, 2014",['English'],1 hr 33 mins,Animation,Rob Minkoff,"['Ty Burrell', 'Max Charles', 'Ariel Winter']",3.5,3.6,,"https://static.toiimg.com/thumb/msid-61241061,width-219,height-317,imgsize-6846/61241061.jpg"
Dallas Buyers Club,"22 Nov, 2013",['English'],1 hr 57 mins, Biography Drama,,,4.0,4.0,"This is his incredible life story, told with a dash of humour and an empathy-evoking narrative. Brilliant would be an understatement.","https://static.toiimg.com/thumb/msid-62523874,width-219,height-317,imgsize-21632/62523874.jpg"
Nebraska,"28 Feb, 2014",['English'],1 hr 46 mins,Adventure,Alexander Payne,"['Bruce Dern', 'Will Forte', 'Bob Odenkirk']",4.0,3.7,,"https://static.toiimg.com/thumb/msid-61241219,width-219,height-317,imgsize-13772/61241219.jpg"
Non-Stop,"28 Feb, 2014","['Hindi', 'English', 'Tamil']",1 hr 46 mins,Action,Liam NeesonActor,,4.0,3.9,"If there's a film that is pretty much true to its name, then this one is it. Another variation on the classic theme of a plane hijack, the movie is relentless with not a wasted second.","https://static.toiimg.com/thumb/msid-61914123,width-219,height-317/61914123.jpg"
Pompeii,"21 Feb, 2014","['Hindi', 'English', 'Tamil']",1 hr 44 mins,Action,Paul W. S. Anderson,"['Kit Harington', 'Emily Browning', 'Adewale Akinnuoye-Agbaje']",3.5,3.4,"The love story itself is forgettable and cheesy. But that is only incidental compared to what you can watch this movie for - fight scenes and cataclysmic climax, both produced and recreated nicely.","https://static.toiimg.com/thumb/msid-61914123,width-219,height-317/61914123.jpg"
The Monuments Men,"21 Feb, 2014",['English'],2 hrs 1 mins,Action,"George Clooney, Actor","['Bob Balaban', 'Dimitri Leonidas', 'Hugh Bonneville']",3.0,3.1,"The film makes a profound point in a subtle way - that the Führer's ambitions if left unchecked would have been world-altering, in the most unsettling of ways.","https://static.toiimg.com/thumb/msid-61914123,width-219,height-317/61914123.jpg"
Winter's Tale,"14 Feb, 2014",['English'],1 hr 58 mins,Romance,Akiva Goldsman,"['Colin Farrell', 'Russell Crowe', 'Jessica Brown Findlay']",3.0,3.1,,"https://static.toiimg.com/thumb/msid-61241202,width-219,height-317,imgsize-125727/61241202.jpg"
Her,"14 Feb, 2014",['English'],1 hr 40 mins,Romance,Spike Jonze,"['Joaquin Phoenix', 'Amy Adams', 'Rooney Mara']",4.0,3.9,,"https://static.toiimg.com/thumb/msid-61914123,width-219,height-317/61914123.jpg"
RoboCop,"14 Feb, 2014","['Hindi', 'English']",1 hr 40 mins,Action,,,3.5,3.5,,"https://static.toiimg.com/thumb/msid-61914123,width-219,height-317/61914123.jpg"
Vampire Academy,"14 Feb, 2014",['English'],1 hr 45 mins,Action,Mark Waters,"['Zoey Deutch', 'Lucy Fry', 'Danila Kozlovsky']",3.5,3.7,"If you like campus romances disguised as thrillers, you are bound to be entertained. And if you happen to be a fangirl/fanboy of those good-looking brooding vampires, then you're in for a treat.","https://static.toiimg.com/thumb/msid-61914123,width-219,height-317/61914123.jpg"
Rock Paper Dice Enter,"07 Feb, 2014",['English'],1 hr 20 mins,Thriller,Shreela Chakrabartty,,2.0,2.1,"The only noteworthy thing about the movie is the concept it started out with - which to be fair, is unique. But despite that, it goes wrong in almost every other department.","https://static.toiimg.com/thumb/msid-61914123,width-219,height-317/61914123.jpg"
The LEGO Movie,"07 Feb, 2014",['English'],1 hr 41 mins,Animation,Phil Lord,"['Chris Pratt', 'Elizabeth Banks', 'Will Arnett']",4.0,3.9,"Novel, wild, irreverent and inventive, this movie is a multicoloured marvel. It takes characters just a few centimetres tall and creates a story like you've never seen before in an animated film.","https://static.toiimg.com/thumb/msid-61914123,width-219,height-317/61914123.jpg"
Lone Survivor,"07 Feb, 2014",['English'],2 hrs 1 mins,Action,Peter Berg,"['Mark Wahlberg', 'Ben Foster', 'Emile Hirsch']",4.0,4.0,,"https://static.toiimg.com/thumb/msid-61914123,width-219,height-317/61914123.jpg"
